<?xml version="1.0" encoding="UTF-8" standalone="yes"?>
<Informe xmlns:xsi="http://www.w3.org/2001/XMLSchema-instance" fecha="2026-05-02" rangoDias="1" xsi:noNamespaceSchemaLocation="esquema.xsd">
    <Paciente>
        <Nombre>Demo Demirez</Nombre>
        <Edad>26</Edad>
        <TipoDiabetes>LADA</TipoDiabetes>
    </Paciente>
    <ResumenInyecciones>
        <TotalInsulinaUsada>7.0</TotalInsulinaUsada>
        <PromedioDiario>7.0</PromedioDiario>
        <DosisMaxima>6.0</DosisMaxima>
        <TotalInyecciones>2</TotalInyecciones>
        <TotalIncidencias>1</TotalIncidencias>
        <MediaInyeccionesDiarias>2.0</MediaInyeccionesDiarias>
        <ZonaMasUsada>abdomen izquierdo</ZonaMasUsada>
        <ZonaMasIncidencias>gluteo derecho</ZonaMasIncidencias>
        <PorcentajeIncidencias>50.0</PorcentajeIncidencias>
    </ResumenInyecciones>
    <Zonas>
        <Zona nombre="abdomen izquierdo" totalInyecciones="1">
            <EventoInyeccion tipo="Sin incidencia" cantidad="1"/>
        </Zona>
        <Zona nombre="gluteo derecho" totalInyecciones="1">
            <EventoInyeccion tipo="dolor agudo" cantidad="1"/>
        </Zona>
    </Zonas>
</Informe>
